<?xml version="1.0" encoding="UTF-8"?>
<xs:schema xmlns:xs="http://www.w3.org/2001/XMLSchema" elementFormDefault="qualified">
  <xs:element name="employees">
    <xs:complexType>
      <xs:sequence>
        <xs:element ref="employee" maxOccurs="unbounded"/>
      </xs:sequence>
    </xs:complexType>
  </xs:element>
  <xs:element name="employee">
    <xs:complexType>
      <xs:sequence>
        <xs:element name="eno" type="xs:int"/>
        <xs:element name="ename" type="xs:string"/>
        <xs:element name="eaddress" type="xs:string"/>
      </xs:sequence>
    </xs:complexType>
  </xs:element>
</xs:schema>
